ConvThread,MessageID,Date,Message,UserID
0,220577,2024-01-29,"Для меня только русский несет, геи мне ничего плохого не сделали",973307262
0,220579,2024-01-29,"Выпьем же за это, друзья! 🥂🥂🥂",1112540507
0,220580,2024-01-29,"У мене таке враження, що хтось із вас пише серйозно, а хтось трішки з сарказмом 😂",724477644
1,219949,2024-01-28,"Нічого в Полтаві не гепає, довіряйте офіційним джерелам. Це все з Кременчука відлуння",5959223607
1,219955,2024-01-28,"може гепає і не в нас, але звук навіть сюди чути",385531315
1,219956,2024-01-28,Це сарказм якщо шо,345520658
2,218662,2024-01-27,"Я ж не про чувака, а про саму залізяку",347152596
2,218666,2024-01-27,так а полицейским респект то за шо?),6250106907
2,218670,2024-01-27,"Та то контрольний, після ""нагла залізяка"" щось між жартом і сарказмом.",347152596
3,218348,2024-01-26,"протиріччя типу нє, не вловили?",74202835
3,218351,2024-01-26,"ну то ж російський серіал, він солідніше",5236866602
3,218354,2024-01-26,"це типу сарказм? Бо українців іноді складно зрозуміти де вони жартують, а де дічь на повному серйозі порять 🙂",74202835
4,217960,2024-01-26,Дуже...,919869804
4,217976,2024-01-26,"В мене бабуся по лікарням була дуже часто ,тому в мене реально нервовий сміх",1621583522
4,217977,2024-01-26,"Я все це розумію, тому теж так написав, але шось навіть сарказм вже якось не виходить, якщо серйозно тотальний бал сатани якийсь, цинічний цинізм",919869804
5,217750,2024-01-25,,569254811
6,212973,2024-01-19,"Мальчик)
Але може викладати дівчатам курси як бути важкодоступною 😂",724477644
6,212975,2024-01-19,норм тип по ходу),1985592765
6,212976,2024-01-19,"О, да)
Він мій улюблений мущинчик для підколів і сарказму😂",724477644
7,211846,2024-01-17,,6025468086
8,211844,2024-01-17,,6025468086
8,211845,2024-01-17,"А,кто говорит ,что Катя виновата ?то был сарказм",1621583522
9,211064,2024-01-14,Щось тут не сходиться,336834854
9,211068,2024-01-14,"Це ж книга Кійосакі. ""Багатий папа, бідний папа"". На неї моляться ті хто не розуміється в економіці.",127273718
9,211069,2024-01-14,"Та знаю, то вже через ""інтелектуальний і конструктивний діалог"" у мене відповідний сарказм включився 😂",336834854
10,208651,2024-01-08,"то не іронія, то сарказм",696839977
11,208255,2024-01-07,"ты не прав - телеграм, к примеру, это просто канал связи и источник иформации и, кстати, из-за твоего ошибочного мнения, потом тебя кто-то там и ищет)",1985592765
11,208262,2024-01-07,"Это никак не связано почему меня кто-то собрался искать) как говорил классик ""шутка, это я шучу, если ума нету шутку не воспримишь, чувства юмора, иронии, самоиронии нету, значит не воспримишь, паскуда. Ну и для того, чтобы не быть паскудой для этого надо быть добрым человеком""😁",1690909691
11,208266,2024-01-07,"типа ирония/сарказм это ещё юмор, а прямое оскорбление это оскорбление...",1985592765
12,208265,2024-01-07,"Все очень просто, не пишешь мне  - не находишь повода для обиды на мой сарказм или иронию",1690909691
13,206182,2024-01-03,"Бачила на автовокзалі за трц Києвом стояли 4 з папкою,роздавали",527002445
13,206183,2024-01-03,"классная серёжка, вам идёт",1985592765
13,206184,2024-01-03,Дякую 😏(надіюсь то був не сарказм 😅),527002445
14,206129,2024-01-03,"Звичайно,але облава на Половках біля Пожарки була не сарказмом)",6399012723
15,206024,2024-01-03,"А,с каких это делов ?",1621583522
15,206027,2024-01-03,"Вас же тут все не влаштовує 
А буде тільки гірше",681341276
15,206029,2024-01-03,"Офігенний підхід.
Сподіваюся що то сарказм.",724477644
16,204761,2023-12-30,А що тут поганого?,222404066
16,204765,2023-12-30,"квиточка, шо за дела? Насрала под чужим постом, а потом спрашшивать, шо тут поганого) А где я писал про погане? Я говорил про разные критерии оценки. Може по хер знает какому скопусу (там на слайде какая-то байда) стояк лучший, а по клубнике аграрка!)",6250106907
16,204842,2023-12-30,Насрала? То ви адресою помилились. Серуни тут інші. Ну а сарказм напевно я не повинна була помітити,222404066
17,204782,2023-12-30,Откуда такие познания?),958997934
17,204791,2023-12-30,"Выше написано смс от девушки  которая сидела в машине) и это моя близка! Это был сарказм кстати, человек приехал на неделю к жене и ребенку.",480400435
17,204793,2023-12-30,Аааааа. Не распознал сарказма,958997934
18,204764,2023-12-30,"Саня, это все вранье, он соску катает)",480400435
18,204782,2023-12-30,Откуда такие познания?),958997934
18,204791,2023-12-30,"Выше написано смс от девушки  которая сидела в машине) и это моя близка! Это был сарказм кстати, человек приехал на неделю к жене и ребенку.",480400435
19,202705,2023-12-28,Шо ты мелеш?,1621583522
19,202708,2023-12-28,Нічого особистого.дай трохи погнати,344289131
19,202718,2023-12-28,"Я подарую тобі свою табличку з написом ""сарказм"")",716683105
20,202114,2023-12-27,Конкретно цей працює на токомак реакторі ядерного синтезу,408130187
20,202120,2023-12-27,Шо,222404066
20,202122,2023-12-27,Гугл. А іще іронія. Чи сарказм. Я їх плутаю,408130187
21,200310,2023-12-26,"Нагадайте, як вам сьогодні написали про мене)))",679676925
21,200311,2023-12-26,Що ви казали що за два тижні буде перемога. Було таке?,127273718
21,200322,2023-12-26,"Ні, я такого  не говорила,  по більшій мірі серйозно. Навіть коли арестович всім брехав, я говорила що війна надовго.
Але якщо це був сарказм, який люди не розуміють, то все можливе.",679676925
22,199534,2023-12-26,Ви агент кремля 🌚,919869804
22,199574,2023-12-26,Я мама 2 учнів початкової школи. Корінна полтавчанка,5114215217
22,199789,2023-12-26,Ви не зрозуміли сарказм,919869804
23,193940,2023-12-18,А ти попрактикуйся в їзді по Ветеринарній .,1066956173
23,193949,2023-12-18,"Не на часі!!!!! Я дивлюсь у вас і авто є, а люди сидять без світла і тепла в Херсоні! Віддайте авто на ЗСУ і не потрібно буде нічого ремонтувати! (Якщо що - сарказм 🌝)",363667194
23,193952,2023-12-18,"А я бус віддав в ЗСУ, а Ви? Якщо що то без сарказму.",1066956173
24,193938,2023-12-18,"вмію, практикую",479032576
24,193940,2023-12-18,А ти попрактикуйся в їзді по Ветеринарній .,1066956173
24,193949,2023-12-18,"Не на часі!!!!! Я дивлюсь у вас і авто є, а люди сидять без світла і тепла в Херсоні! Віддайте авто на ЗСУ і не потрібно буде нічого ремонтувати! (Якщо що - сарказм 🌝)",363667194
25,192316,2023-12-15,Тирпирпирпирпирпир цю машину вже не спинити,716683105
25,192317,2023-12-15,Процес пішов😂,724477644
25,192325,2023-12-15,"Він ще не пішов, він тільки прийшов 😂

Казали мені колись - носи з собою табличку з написом сарказм, щоб ніхто випадково не образився, оце й тут так треба, під кожним повідомленням писати)",716683105
26,190177,2023-12-13,Кошмарите насправді)),1830249564
26,190219,2023-12-13,Ок,679676925
26,190220,2023-12-13,"це сарказм, якщо що)",1830249564
27,189812,2023-12-13,"Картина була інша

>В неї теж є колода Таро і власний сад з ядовитими рослинами. І шо? Кожній людині треба якесь хобі.

>Головне щоб вона зерняток не їла з того саду

>Ні, вона їх таким як ви підкидує, шоб не мішались під ногами.)

>На підваль🤝 піду напишу заяву і скажу шо в Полтаві живе дівка яка труїть людей",545667642
27,189814,2023-12-13,Про «подумки» ви додали вже після відповіді про заяву,545667642
27,189817,2023-12-13,"Угу, і смайл я теж дописав? Але ви ж такі люди, що дійсно можете не зрозуміти сарказму, прийшлося дописати))",127273718
28,188701,2023-12-11,"Вам треба було заходити на тендер по установці плитки в туалеті ..до ,речі ,такі самі прості і стандартні речі ,нам тоді так помпезно підносили...",1621583522
28,188702,2023-12-11,Та я ж тільки по металоконструкціям. Мрамор то не до мене🤣,607736573
28,188703,2023-12-11,"Ну то сарказм був з моєї сторони...)))а,взагалі ,крім генделиків ,клумби і дитячого майданчика нічого там не має ,атракціони то не рахується ,бо то не комунальне..хоча ,я признаюсь -я ,тоді в неї вірила ,бо ще в школі ми разом займалися спільними справами",1621583522
29,184211,2023-12-07,"я зайшла сказати, що з ялинки роблять якийсь культ і ніхто не пікетує чогось нічні клуби в коменду і нереально абсурдні закупівлі. а тут по факту приватні, нещасні, 400к 
ну і понеслась",336834854
29,184216,2023-12-07,Ти молодець,383087929
29,184222,2023-12-07,"хз чи то сарказм, просто ділюсь 🤷‍♀️",336834854
30,183792,2023-12-07,"Віка, так чат публічний, так кожен має право висловитись. Але кожен може кожного і послати чи захейтити. І кожен вже вибирає чи йому ображатися на це чи ні. Але там не було ні разу, щоб звинувачували в таких випадках в болінгу, як зробила це ти.
От скажи мені, тільки чесно, що тобі в поліції відповіли на твої звернення та скарги? Протокол хоч написали чи зафіксували твоє звернення? Який у нього номер?",395920342
30,183796,2023-12-07,Вони вас назвали хворими і що ви працюєте на ворога,222404066
30,183799,2023-12-07,А ти сарказм точно розумієш?,395920342
31,183724,2023-12-07,Важко зіпсувати репутацію парою повідомлень від тролів.,716683105
31,183766,2023-12-07,"Парою? Ти взагалі читала ці всі дні? Я можу тобі кинути скріни, щоб ти зрозуміла як це виглядає для лівої людини, яка зайде в чат",222404066
31,183771,2023-12-07,"Мене це абсолютно не хвилює. Це проблеми тих людей, які не можуть з першого разу зрозуміти що таке іронія, сарказм, пост іронія і починають з цього роздувати казна що. Щоб що???

Не знаєш про що мова в чаті - не бери участі в диспуті. Все логічно",716683105
32,179067,2023-11-29,"Ні, суть в тому, щоб зробити це безкоштовно",222404066
32,179070,2023-11-29,https://uk.wikipedia.org/wiki/%D0%A1%D0%B0%D1%80%D0%BA%D0%B0%D0%B7%D0%BC,478097912
32,179075,2023-11-29,"Та воно то навіть не сарказм в наших реаліях, бо вони реально це можуть зробити",222404066
33,179029,2023-11-29,Проект прикрашання буде коштувати 500 тис грн,478097912
33,179067,2023-11-29,"Ні, суть в тому, щоб зробити це безкоштовно",222404066
33,179070,2023-11-29,https://uk.wikipedia.org/wiki/%D0%A1%D0%B0%D1%80%D0%BA%D0%B0%D0%B7%D0%BC,478097912
34,177818,2023-11-25,"Лошара позорний, продав сраку всього за 5000😂😂😂",624359638
34,177856,2023-11-25,"Самий класний коментар, а решта 🤮, як і сама новина.
Взагалі не розумію, навіщо пану Фонтану сіяти ненависть та заздрість між людьми, в такий тяжкий для України час? Вчипилися в тих суддів як вош в кожуха, можна подумати в других професіях всі такі святі та Божі?
Заздрити їх грошам дурне діло, бо за їхню роботу треба ще більше платити.
І не зайве було б знати, що всі судді України з початку повномасштабного вторгнення відраховують щомісяця з своєї зарплати 40%  на ЗСУ. Крім того, збирають ще по запиту від військових  на нулі гроші на машини та ремонти цих машин.",861745354
34,177861,2023-11-25,"Це сарказм?
 За їх роботу треба платити ще більше...",131687239
35,176826,2023-11-22,Штраф 34к гривень і ізвєнєнія. Перед ними. 🤣🤣🤣,344289131
35,176926,2023-11-22,Ну ты клоун!,5248510063
35,176927,2023-11-22,"В сарказм вмієш, ні?",344289131
36,176334,2023-11-20,"Такого колапсу, як сьогодні,  навіть при Мамаї не було 😀",398927173
36,176377,2023-11-20,"При ньому буле ще гірше!!!
А це не колапс це ожеледиця!!)))",639430140
36,176388,2023-11-20,"Це був сарказм, взагалі-то) а ожеледиця перестає бути колапсом з великою кількістю дтп, коли злагоджено працюють комунальні служби. А мер міста -це менеджер, котрий має відповідати за всі процеси життєдіяльності цього міста. І, якщо, стається такий треш на дорогах, як сьогодні, то це цілком і повністю відповідальність мера. В нашому випадку, виконувача обовʼязків. Але у своєму інстаграмі вона пишається тим, як працюють комунальники сьогодні. Тому у мене більше немає питань 🤦🏼‍♀️",398927173
37,173858,2023-11-14,Нажаль у Каті чарівної палички не має,1621583522
37,173876,2023-11-14,"Та невже? А тим людям що робити?
Хай тоді поселить туди свою родину. Ні?",589879527
37,173877,2023-11-14,"Это был сарказм ,если шо ,вон пойдите у нее и спросите ,что делать людям",1621583522
38,172078,2023-11-08,"Ідеальних умов у нас немає і не буде. Просто надія всієї Полтави Катерина Ямщикова непер офіційно не зможе закупити ті дрони, а ті що розкрадають навіть на харчах точно не закуплять нічого.",469513168
38,172079,2023-11-08,Про Надію Ямщикову не перегибай))),958997934
38,172081,2023-11-08,Сарказм,469513168
39,171985,2023-11-08,,676331094
40,171411,2023-11-06,Це сарказм,6286098375
41,170803,2023-11-03,,881895316
42,167317,2023-10-21,"Певно, тільки Пронін і члени цієї групи. Якщо сторонні будуть знати, то взнає ворог. А нам і так не потрібно гучних корупційних скандалів, принаймні місяць.
P.S. Сарказм.",395920342
43,166180,2023-10-16,"Вибачте. Але коли моя 8-ми річна донька гуляє зі своїм Шпіцем і на них нападає зграя собак. То я не тільки тих собак перестріляю... Ситуація з життя, доньці вже 12",958997934
43,166181,2023-10-16,Так то твій шпіц і спровокував зграю пухнастих цуциків. Їм стало завидно.,395920342
43,166182,2023-10-16,Сарказм.,395920342
44,165323,2023-10-12,Звідки в першокурсника гроші на іграшки? Підручними матеріалами дешевше🤦🏼‍♀️,301235146
44,165331,2023-10-12,Так він і використав підручні матеріали!,552441382
44,165334,2023-10-12,Сарказм просто існує 🗿,301235146
45,164694,2023-10-10,"Сподіваюсь, це сарказм",958997934
46,163538,2023-10-07,"Або якісь невисокі, екзотичні, бажано по 50-60к. за штуку(сарказм, якщо що)",5110923582
47,163508,2023-10-07,"Є. Але нащо рубати згнивші дерева, їх же нікому не продаси! - ""сарказм"" 🤷🏻‍♀️😕",1031753954
48,163074,2023-10-06,"Насправді то вона в сарказм намагається.
Кляті бандерівці лютують й перейменовують ""близкие сердцу названия""",592763671
49,162950,2023-10-05,Это сарказм,222404066
50,161734,2023-09-29,"Скільки мільйонів на цей логотип витратили, зізнавайтеся?! (Сарказм) 😂",377975115
51,161668,2023-09-29,Последних 2 названия это сарказм,962189481
52,161523,2023-09-28,А це вже сексистські наративи),958997934
52,161524,2023-09-28,Невже?),464258002
52,161526,2023-09-28,Сарказм,958997934
53,159501,2023-09-22,Щоб було зрозуміло всім. Нова влада хоче зробити транспорт як в Європі 1 раз на годину. Тому скоро будемо просити щоб повернули Животенка. Чекаємо.....,1009708688
53,159504,2023-09-22,В Європі такого немає,222404066
53,159509,2023-09-22,"Страшна Європа з її страшним транспортом з інтервалами 15 - 45 хвилин в залежності від маршруту з великими автобусами. Люди на кільці не зможуть доїхати куди треба, Вакуленці і Дублянщина не зможуть приїхати в Екватор не роблячи пересадку, хаос буде (сарказм)",631669048
54,158961,2023-09-20,Таким як і Бандера,222404066
54,159060,2023-09-20,"Бандера не був і на відміну від Шухевича, героя України, присягу Гітлеру не давав.",5775641973
54,159073,2023-09-20,"Та про Шухевича то був сарказм. Шо Бандера, шо Шухевич до Полтави ніяким боком",222404066
55,157388,2023-09-15,Та тут ніхто цього не розуміє. А твій сарказм про депутатіч сприймають як чисту монету,881895316
56,157206,2023-09-14,"Ямщікова, хдє рємонт мусарних баков?!",2038994594
56,157313,2023-09-15,"До чого тут одна Ямщикова?
Культура починається у кожного із нас. Якщо бачите, що хтось смітить, самі не проявляйте байдужість. Заставте підібрати сміття. Звоніть у правоохоронні органи (не тільки біля порнорозваги їм сидіти). У всіх є смартфони, фіксуйте злочин, направляйте це у потрібному напрямку. Ви ж нарід освічений, цивілізований. Вас не треба вчити. Що одразу одна Ямщикова?🤷‍♀",5330377204
56,157333,2023-09-15,"Ну по перше. Це був гумор. Сарказм. Ну так, не однозначний. Розумійте, як хочете) А по друге. Ой не все прям від нас залежить 😜",2038994594
57,154294,2023-09-08,"Та це ж просто ідеальний вибір для Полтавщини. Беремо, хуй з ним, гірше вже не буде (сарказм)",469513168
58,153834,2023-09-07,"Ну вони використали в цій війні всі природні елементи, багато сакральних символів і ще купу всього. І що нам тепер новий світ придумувати?",222404066
58,153848,2023-09-07,ну погодьтесь якось було б тупо запалювати вогонь як пам'ять про  людей які припустимо згоріли заживо,261787711
58,153849,2023-09-07,Більше схоже на сарказм - горіть вічно!,885491484
59,153212,2023-09-06,"Без сарказму, скільки державних ""ефективних"" підприємств ще треба продати...",5737892516
60,149704,2023-08-28,тут питання ще в тому хто це перекладав? хто автор? яке видавництво? якщо не русняве - читайте якщо немає альтернатив,373007194
60,149728,2023-08-28,"Ви дозволяєте? Ох, превелике дякую.",222404066
60,149731,2023-08-28,"Мені здається сарказм недоречний, тим паче у відповідь на повідомлення несаркастичного характеру. Ось це вже виглядає як моветон 😕",373007194
61,149648,2023-08-28,,373007194
61,149652,2023-08-28,"Ви не розумієте, він же вузькоспеціалізований)",620339054
61,149689,2023-08-28,І до чого тут ваш сарказм?,222404066
62,148914,2023-08-28,"Ну я так і не побачила в словах людини приниження мови. Приниження людини - так, але не мови",222404066
62,148916,2023-08-28,Там приниження мови в першу чергу!,679676925
