ConvThread,MessageID,Date,Message,UserID
62,148947,2023-08-28,"Та це її друг, вони разом ""великі волонтери"" які на початку повномасштабного волонтери "" не покладая рук"" 
сарказм",881895316
63,146898,2023-08-23,"Не пизди , мій друг його підіймав",1041050304
63,146903,2023-08-23,Може то був сарказм на питання в цьому пості?,580069707
63,146904,2023-08-23,"Може я не поняв сарказма?))) прикінь , бува таке",1041050304
64,146897,2023-08-23,мамай прапор підіймає,580069707
64,146898,2023-08-23,"Не пизди , мій друг його підіймав",1041050304
64,146903,2023-08-23,Може то був сарказм на питання в цьому пості?,580069707
65,145765,2023-08-19,"я не казав, що це договорняк. то був сарказм щодо гола вереса. а щодо голів, то у нашому чемпіонаті 75% таких голів забивають, можна кожен другий матч вважати за договорняк.
але мені, як казав Лобановський, важливий лише результат. і сьогодні він позитивний. все інше забудеться за 3 дні",516292934
66,142516,2023-08-11,знову $6к нести 🙁,51098087
66,142521,2023-08-11,Краще задонать на дрони.,5737892516
66,142524,2023-08-11,Та то був сарказм,592763671
67,139307,2023-08-03,"Я думаю Катерине будет очень не просто "" с корабля на бал"". Человека на lowest price detected. надо брать на ставку. 
 Желаем ей успеха. 🤞",662919630
67,139311,2023-08-03,"Сподіваюсь так же і піде по тупому,як і прийшла",580069707
67,139319,2023-08-03,Я не закладывал сарказм,662919630
68,138515,2023-08-02,"Пане Олександр, ви до людей в кишеню не лізьте, в двічі дешевше, бач, хочуть!)))",531036865
68,138527,2023-08-02,"Пан Олександр має повне право таке писати, бо саме він як і десятки інших бійців потім їх ремонтують на передку (або не ремонтують, бо ніяк)",222404066
68,138528,2023-08-02,То сарказм був,531036865
69,138165,2023-08-01,"Сначала думал, сарказм. А потом понял, хуйня!!!",958997934
70,138097,2023-08-01,"В каждом военкомате есть такой ходок.И ваще,чувак жизни спасает,а вьі его задерживаете.",580069707
70,138098,2023-08-01,"Лучше сказать - разменивает. Кто-то погибнет вместо ""откосивших"".",592763671
70,138099,2023-08-01,То був сарказм.,580069707
71,136927,2023-07-29,Вам ніхто не повірить,131687239
71,137122,2023-07-29,Вообще-то я верю. Регулярно новости про эти дыры в асфальте + возле дома была одна недавно,389923053
71,137125,2023-07-29,Та блін. То був сарказм... Як можна в Полтаві і не повірити в дірки в асфальті,131687239
72,136822,2023-07-29,"Та по ньому видно ,що пахне з голоду",1621583522
72,136836,2023-07-29,А в Полтаві голод?,589879527
72,136837,2023-07-29,"Сарказм ,нє?",1621583522
73,136523,2023-07-28,"Бажаю вам від щирого серця пережити такий ""піар"", як Катерина чи Вадим. 
Розкажете потім, якщо виживете, як воно 😑

А ви коли йдете кудись працювати, то ви підписуєтесь кровʼю, що ніколи звідти не підете ні за яких обставин?",120061352
73,136526,2023-07-28,І можете розказати всім що там такого пережили ямщикові? Це тут всім буде дуже цікаво,222404066
73,136594,2023-07-28,"Та най буде, як вам уявляється і вважається - своя, не своя, знаю, не знаю, думаю, не думаю. Вам не потрібні ці всі відповіді, ви все для себе вже знаєте заздалегідь по всім питанням навіть не заданим. Намагатись вам щось пояснити - тільки гаяти час. Та і все ж у вас в коментаторських баталіях явно досвід більший за мій. Чи то ваше хоббі, чи робота, без поняття.
Сподіваюся (без сарказму), ви в реальному житті дуже принципова борчиня за істину і все праведне ✊",120061352
74,134451,2023-07-24,Так все тіп з  цією послицею. На відміну від послів в Британії чи Німеччині...,131687239
74,134479,2023-07-24,А що не так з послом в Британії?,193883410
74,134501,2023-07-24,Осмілився назвати спіч Верховного нездоровим сарказмом,131687239
75,134193,2023-07-22,"Олена, ви все вірно кажете. Все життя буде як мінімум за Дніпром, а як максимум на заході України",603282138
75,134194,2023-07-22,"Позняки, Оболонь, Харківський і т.д терміново почали шукати квартири на іншому березі)))",958997934
75,134195,2023-07-22,"Сарказм зараховано) Але читаючи різних експертів, розумієш, шо розділ Польщі України вже готується. Одна частина вступає в ЄС і НАТО, інша-попадає в окупацію.",603282138
76,130354,2023-07-07,"Навчиться поважати будь яку працю. Без сарказму , а з вдячністю.",674860346
77,130349,2023-07-07,"цікаво скільки буде сарказму привідсутності таких благ, як водопостачання та водовідведення? Бо розумахи лише по клавіатури виказувати свій сарказм.  Навчиться дякувати тим хлопцям з фото. Бо ви й гадки не маєте як там робити",674860346
78,129687,2023-07-04,"але і серед молодих котрі ніколи і не жили в совку бидла вдосталь, котрі бачили як живуть в розвинених країнах, хоча б через інет. Не треба всі проблеми нашого суспільства валити на країну котрої нема вже 30 років",505843078
78,129695,2023-07-04,"А хто цю молодь виродив?!
Хто на сьогодні у кріслах засідає, корупцію творе???
Тепер непросто відновлювати, що втрачено.😢 У мене на моїй площадкі не набагато молодші від мене, теж розпусні. Та поступово мені вдається на них вплинути, бо сама людяна.",5330377204
78,129697,2023-07-04,"ну в кріслах зараз не радянські чінуши та всі після 14 року патріоти, сарказм. Але, взяти мій приклад та мого оточення, друзів та родичів, у мене і у них батьки і дідусі з бабусями виходці з того ж совку, але я і вони чомусь не засирають нічого навколо себе і нічого не ламають. Знову ж таки, людині не подобається жити в гівні тому найпростіше це гівно не розводити довкола себе. Це ж так просто",505843078
79,128658,2023-06-29,Як це немає? Ви бачили скільком людям в чаті не сподобалося її діяльность? Хіба цього вже недостатньо?,131687239
79,128660,2023-06-29,якби так все було просто),452790628
79,128703,2023-06-29,То був сарказмЪ,131687239
80,127994,2023-06-25,У Бахмут! 🤟🏼😉,6016961286
80,128010,2023-06-25,Нахуй він там потрібний?,609439889
80,128011,2023-06-25,"Хто його зна. Це сарказм. 
Але, по ту сторону й такі є.",6016961286
81,126848,2023-06-21,то спроба сарказму була),452790628
82,124912,2023-06-14,"Судя по тому как админ полтавской трухи зеленых любит, то все гармонично. Полизали власть, власть полизала их. А то что по началу выкладывали видосы и фотки прилетов та то фигня.. та и сама труха рашковский проект, это все мелочи.. главное чтоб лизали (сарказм)",327351172
83,123583,2023-06-08,Ну по перше це робочі місця...🙄,131687239
83,123590,2023-06-08,"Мінімальна і к-сть їх і додана вартість яку вони створюють. Робочі місця, це вагонний завод, яких хотів тігіпко побудувати до війни. Це турбомеханічний завод, який робив важливу продукцію, а тепер зносять під забудову. Економіка не може вижити на одній лиш сфері послуг.",408130187
83,123596,2023-06-08,То був сарказмЪ,131687239
84,123205,2023-06-07,"честный налоговик, поднялся с нуля сам, своей головой(то був сарказм. Азирову приветики).",327351172
85,122559,2023-06-04,"Чому таке здивування і сарказм про вміють грати? Ворскла стабільно кожен рік в єврокубках, просто невдалий старт був в цьому році)",5945155322
86,122153,2023-06-02,"Або інтуїція, або аналіз",222404066
86,122166,2023-06-02,"А мені здається типовий мешканець Лохвиці, в чому ніхто й не сумнівався. Треба у вас питати, ви судячи з усього поважний фізіономіст, який визначає прописку по вигляду",911488302
86,122188,2023-06-02,"І до речі я психолог та нейротиполог, так що ви точно не за адресою зі своїм сарказмом",222404066
87,115110,2023-04-24,"всем, кто тут возмущается от пяти до семи лет!",775977036
87,115112,2023-04-24,С хуя ли? Вас всё устраивает?,592763671
87,115113,2023-04-24,"Да нет, конечно. Сарказм от безысходности.",775977036
88,114522,2023-04-20,"А багато з отих що хочуть валяти памятники, знають як виглядав жуков чи Ватутін? А Шухевич і Петлюра?
Можна легко зняти памятник Ватутіна  в Полтаві і потавити в Житомирі як Шухевичу. І навпаки. Головне, зірки на погонах стерти.
Все одно ніхто не дивиться на того ""мужика на коні""",301093193
88,114524,2023-04-20,Так наче ж є фотки та деякі відеокадри.,6257387922
88,114526,2023-04-20,Це сарказм,301093193
89,111072,2023-04-04,"Якщо це був сарказм жорсткий,  то я оцінив)))",738493448
90,106859,2023-03-15,"От дивись. Є твоя точка зору і я її поважаю, її розділяє якась кількість людей. Є моя точка зору і в ній теж є прихильники. Шо роблять в цивілізованих країнах? 

Правильно,  голосування. Як громада об'єктивно проголосовала,  так і зробили. Як на мене це і є демократія. Чи ні?",546607747
90,106869,2023-03-15,А шо це?,919869804
90,107411,2023-03-19,"Это сарказм и ирония, над псведопатриотизмом",546607747
91,105494,2023-03-08,Вимкніть негайно. Режим світломаскування невже відмінили?,131687239
91,105502,2023-03-08,"А хіба є сенс у тому світломаскуванні? Зараз якщо щось і літає, то по координатам",842673647
91,105527,2023-03-08,То був сарказм.,592763671
92,104574,2023-03-03,,842673647
92,104577,2023-03-03,"Оо вперше я побачив такого ДЕГЕНЕРАТА хочь ти і баба боже яке ти кончіне, чому чому блять, тому що їх ПВО збивало блять",851554460
92,104582,2023-03-03,Слово сарказм знаєте?,842673647
93,103598,2023-02-27,Жінка яка купила квіти БИДЛО і взагалі не мала ніякого права себе так поводити. Квіти завʼяли від її чорного рота.,586628284
93,103646,2023-02-27,"Я повністю згодна з тим, що так спілкуватися соромно з людьми. Але квіти мають відповідати своїй вартості",375705935
93,103653,2023-02-27,"Я, звісно, не буду сперечатись що квіти мають ще прибирати дім за такі гроші, а яйця по сотні самі себе готувати
Але якщо продавчиня довела, що вказані квіти реанімувались при вказаному догляді, то до чого цей ваш сарказм? Виходить, товар нормальної якості?",495506238
94,103002,2023-02-25,"Ну в Полтаві точно є сенс боротися з ""вихідцями з Кавказу"" та мігрантами, куди не плюнь- одні іноземці",546259226
94,103007,2023-02-25,де ти їх бачиш куди не плюнь? якось заважають тобі?,213433669
94,103013,2023-02-25,Та я в в сарказм,546259226
95,100797,2023-02-15,"То є сарказм звісно, бісить коли додіки виправдовують своє небажання слухати українське, або нехай не українську музику а західну, відсутністю такої",472211594
96,100753,2023-02-14,То був сарказм 😉,1009507256
97,98663,2023-02-07,Так точно,681341276
97,98664,2023-02-07,"Може у вас і так, но я думаю ви передивились бойовиків",983543948
97,98665,2023-02-07,"Я думаю, ви не зрозуміли сарказм",681341276
98,98072,2023-02-04,"А взагалі, сумно що ви не розумієте, що все написане вище є сарказмом. Якщо люди дійсно марять тим що б зруйнувати одні з візитівок міста, то це все дуже сумно. При цьому , зносячи одні символи тієї влади не чіпаючи інші символи і пам'ятки тих же  часів і того ж символізму",505843078
99,97529,2023-02-02,"Данілов же сказав, що це наші партизани. Вже нє? (сарказм) 😂",377975115
100,88791,2022-12-31,"В першу чергу це виховання. Якщо мама з татом не навчили, то біда. В другу чергу, це вже соціум, якщо людина бачить, що нічого за таке свинство не буде, то чому б не кидати сміття де попало. За таке треба штрафувати, потрібно для початку патрулювання, а в подальшому камери повсюди з можливістю ідентифікації особи. Отоді може й буде толок. Кинув обгортку від сигарет чи цукерки - отримай штраф гривень на 200-300. На другий раз може подумає чи вартує його свинство зароблених грошей.",345632420
100,88809,2022-12-31,"Та що ви? Розстрілювати за таке потрібно по закону військового часу... Або як ""мародерів"" до стовпа прив'язувати...",131687239
100,88822,2022-12-31,С - сарказм?,345632420
101,85433,2022-12-20,"Ну от можливо завтра і змінять, а до цього були невеликі морози",842673647
101,85441,2022-12-20,"Невеликі морози були і минулого тижня і ? Навіть 4+ 2- не було, взагалі не відключали цілу неділю.",835083311
101,86620,2022-12-23,А пам'ятаєте як в мирний час через морози виникали якісь проблеми із світлом? Це сарказм хто не зрозумів.,404040009
102,84316,2022-12-16,"Ото кек, ""красівий"" знову під'їбав. А як там справи з гречкою? Всю розібрали, чи ще можна знайти?
Це сарказм раптом що",592015007
103,84139,2022-12-16,А чого ті люди пишуть вам? А не зразу в ООН?,301093193
103,84141,2022-12-16,Від ООН менше толку,345520658
103,84142,2022-12-16,Сарказм,301093193
104,83687,2022-12-14,"Ти притомний?Як тільки рука піднялася  надрукувати аж таке?Шось мериканське викинути?Та ти консерва,напевне.Спитай у гугля про абсурд,гіперболу,іронію та сарказм.Не бійся,гугль кошерний",923066123
105,83351,2022-12-12,Це був сарказм,574727257
106,80398,2022-12-05,"без сарказму, НАТО одягає нас, тож простіть, але ми йдемо до їх стандарту.",361540795
107,80390,2022-12-05,"Да, тут уже без жартів і сарказму: НАТО має йти до стандартів ЗСУ, а не навпаки!",192737706
108,78131,2022-11-30,"Зато ты, походу, готов дать, передать.....😂😂😂😂",5248510063
108,78132,2022-11-30,"Нет, за тебя волнуюсь. Нет оргазма- есть сарказм (твой). Сам же сказал😆",1830249564
108,78133,2022-11-30,Про сарказмы в мужском кружке это ты тут постоянно лепишь,5248510063
109,78099,2022-11-30,"Не, все толерантные))) А судя по постам выше, как раз с Левады тебе телочки и не дают!",1830249564
109,78131,2022-11-30,"Зато ты, походу, готов дать, передать.....😂😂😂😂",5248510063
109,78132,2022-11-30,"Нет, за тебя волнуюсь. Нет оргазма- есть сарказм (твой). Сам же сказал😆",1830249564
110,78070,2022-11-30,"Походу, это ты не сечешь, мимо тазика сходил😎",5248510063
110,78072,2022-11-30,"Прекрасно секу. Это был сарказм, LOLка",1830249564
110,78073,2022-11-30,"Когда нет оргазма, переходят до сарказма 🤣",5248510063
111,78053,2022-11-29,Шляпа походу сегодня в руке твоей)))),1830249564
111,78070,2022-11-30,"Походу, это ты не сечешь, мимо тазика сходил😎",5248510063
111,78072,2022-11-30,"Прекрасно секу. Это был сарказм, LOLка",1830249564
112,76671,2022-11-23,Це сарказм,478219180
113,72595,2022-10-28,"Сарказм?! Пів холодильника на сміття,йобйогомать,мені шо,тринькати гроші нікуди більше? По 7 годин без світла бо інших районів,сука,нема? Затратно виходить,м'яко кажучи",331521357
114,72034,2022-10-23,Не розцінила сарказм в першому повідомленні. Зате щойно витерла калюжу  талої води під холодильником,493254555
115,68347,2022-09-27,перероблений 1946-го. Та й причому архітектура до прославлення російської армії?,1830249564
115,68348,2022-09-27,а хіба пам'ятник архітектури не прославляє імперську епоху?,505843078
115,68352,2022-09-27,"Шо, тоже сарказм?",592763671
116,68339,2022-09-27,"Площа й так пласка, з деревами лавками та клумбами.
Ти ебанувся об стіну чи просто невдало жартуеш?",592763671
116,68341,2022-09-27,"Коментар саркастичний, до коментаря що вище.
Тому турбуйтесь краще за свій психічний стан, і мозкову діяльність)",610940888
116,68343,2022-09-27,Та шось не дуже схоже було на сарказм. Ну то проїхали. Наступного разу краще вийде.,592763671
117,66949,2022-09-12,"У депутатів недоторканність, у їх дітей теж(сарказм), голови областей і т.д. - теж саме. Чинуші-багатії - імунітет грошовий. Правильно, готуємося, селюки і ті, хто не зміг відомими способами відтермінуватися, помирати, щоб вищеперечислені насолоджувалися життям.",361540795
118,65375,2022-08-30,"Так між Веприком і Бобриком чи між Мартинівкою та Воронівщиною? Знаю давно цю закинуту дорогу, там остання машина мабуть в кінці 80- проїхала (сарказм).",1830249564
119,64986,2022-08-28,"Не чорніть будь-ласка нашого мера. Він справжній мужик, і патріот свого міста. При ньому Полтава процвітає",1830249564
119,64989,2022-08-28,Сарказм зарахований),862219109
119,64990,2022-08-28,"Так єбонуте, чи сарказм? Полтава три рази Мамая вибирала, вибере і вдвадцяте",1830249564
120,64978,2022-08-28,Допомогу йому на карту кидать?,862219109
120,64986,2022-08-28,"Не чорніть будь-ласка нашого мера. Він справжній мужик, і патріот свого міста. При ньому Полтава процвітає",1830249564
120,64989,2022-08-28,Сарказм зарахований),862219109
121,63087,2022-08-11,Это сарказм?,409137483
122,56950,2022-06-15,"Не сарказм, т к знаю правило, и постоянно пишу автоматом неправильно",1830249564
123,55595,2022-06-05,"А зрівняти Полтаву з землею, мешканців розвезти по іншим містам. Ви не повірите, при російській імперії Полтава була центром Полтавської губернії, що характеризує Полтаву як місто що підкорялось московитам. І тому таке місто не має права на існування. ЯКЩО ЩО, ЦЕ САРКАЗМ. Як заїбали ці борці з расією в Полтаві. Ще трохи, замість пам'ятника Слави житловий комплекс, замість пам'ятника Зигіну чотирнадцятиповерхівку. А ще можна знести будівлю краєзнавчого музею і оте де СБУ, вони теж при царату збудовані. Цікаво, отим борцям з пам'ятниками фраза ""... до основанья, а затем..."" не муляє?",495756857
