ConvThread,MessageID,Date,Message,UserID
82,274080,2020-03-27,"Не вдалось, бо нічого не змінилось. На превеликий жаль!

Як і майдани в суті нічого не дали, крім всесвітнього піару і загибелі людей. Так як люди прийшли зі старої системи, а система не вийшла з них.
Як в свій час проголосували за Кравчука (який був головою УРСР), Кучму, а не Чорновола. Радянщина лишалась і лишається в головах, яка з часом переросла в СНД, великі бізнеса та клани!

А ті, що йшли проти системи - система або їх ломала, або їх знищували, персонально чи глобально (повстання, війни і тд).

Країни Балтії, Фінляндія, Польща та Німечинна змогли досягнути! Ми ж ще в стані лоботомії радянського-бидло мислення!",214699258
82,274082,2020-03-27,моя улюблена тема - майдани нічого не дали,807654390
82,274083,2020-03-27,Сарказм? 🤨,214699258
83,265468,2020-03-23,"знову сарказм ,все я його вимикаю",235396777
84,265467,2020-03-23,сарказм,807654390
85,265440,2020-03-23,"Людина що пише спочатку ""поставте свічку і все мине саме собою"", зараз радить увімкнути критичне мислення) Хммм....",668925216
85,265441,2020-03-23,ви не знаєтещо таке сарказм?,235396777
85,265446,2020-03-23,"То в які частині ви застосовували сарказм, там, де про свічку, чи там де про критичне мислення?) Бо з ваших слів можна зробити висновок що її можна ставити де завгодно, біля ваших коментаріа))",668925216
86,265443,2020-03-23,"то був сарказм ,вибачаюсь ,що я не поставив поруч табличку.",235396777
87,265440,2020-03-23,"Людина що пише спочатку ""поставте свічку і все мине саме собою"", зараз радить увімкнути критичне мислення) Хммм....",668925216
87,265441,2020-03-23,ви не знаєтещо таке сарказм?,235396777
88,264662,2020-03-22,Днри також громадяни україни?,1055256883
88,264668,2020-03-22,Звичайно.  Ти шо думаєш шо ми по рускіх 5 років стріляєм?,395034700
88,264676,2020-03-22,"Воу-воу, сарказм на грані фолу)",321716873
89,264479,2020-03-22,"Загадка, де більше зробили тестів, як гадаєте, якщо у Києві за сьогодні 20!?",698409414
89,264484,2020-03-22,то дупутати контактувавші з зараженими тестуються,195502393
89,264493,2020-03-22,"Ага мені так подобається, з 423 депутатів 2 захворіли(+ і Разумков уже пройшов тест), а з мінімум 37 млн захворіло (на вчора) 45 людей, тести розподілені рівномірно(сарказм)",698409414
90,263281,2020-03-22,"Ти геть йобу дав, чи це дуже жирний сарказм?",488912728
91,261774,2020-03-21,"Ото ви наїжджаєте на авакяна, а він у складний для країни час працює, примножує свої здобутки. Всім би брати з нього приклад",610064129
91,261777,2020-03-21,С-сарказм,507262628
91,261781,2020-03-21,"Він один з небагатьох, хто за ці роки не злетів з вершини. Це я кажу без сарказму",610064129
92,261774,2020-03-21,"Ото ви наїжджаєте на авакяна, а він у складний для країни час працює, примножує свої здобутки. Всім би брати з нього приклад",610064129
92,261777,2020-03-21,С-сарказм,507262628
93,260476,2020-03-21,То сарказм чи дійсно людське ставлення до тещі?,610064129
94,260454,2020-03-21,Ну сарказм же,802077670
95,259754,2020-03-20,"перше то був сарказм, немає у мене накопичень аби щось від того виграти(",189629613
96,256366,2020-03-19,знов ваш сарказм,376839680
97,256338,2020-03-19,"ЦЕ теж дуже важливо. Тобто, похуй, що воно виходить на каналі Ахметова. Ну і заєбок.",93260642
97,256349,2020-03-19,"Це підтвердило те, що Віктора Ляшка (як єдиного спєца по коронавірусу, сарказм) можуть одночасно показувати на медіа Коломойського і Ахметова.",624067515
97,256356,2020-03-19,А в чому сарказм полягає?,488912728
98,256309,2020-03-19,"Ток-шоу Яніни йде в запису, якщо що.",624067515
98,256338,2020-03-19,"ЦЕ теж дуже важливо. Тобто, похуй, що воно виходить на каналі Ахметова. Ну і заєбок.",93260642
98,256349,2020-03-19,"Це підтвердило те, що Віктора Ляшка (як єдиного спєца по коронавірусу, сарказм) можуть одночасно показувати на медіа Коломойського і Ахметова.",624067515
99,254242,2020-03-18,(табличка сарказм),235396777
100,249681,2020-03-17,"Землю - олігархам, блять",624067515
100,249707,2020-03-17,"Миколо, ти...лівішаєш?)",367903709
100,249710,2020-03-17,Це я про нового міністра економіки. Розумійте мій сарказм,624067515
101,247492,2020-03-16,не понял в чем патруль нашел мовний конфликт,993524269
101,247498,2020-03-16,"Сарказм сарказмом, а правила виконуйте",321716873
102,244581,2020-03-15,Мосійчук брехать не може 😂,610064129
102,244584,2020-03-15,Чому не може?,93260642
102,244586,2020-03-15,"Та ж сарказм. Єдина вартісна інформація, яка від нього виходить: леопард на повідку у Києві",610064129
103,243910,2020-03-14,Може ще Винниченку?,381526805
103,243919,2020-03-14,та цілий тематичний парк УНР забабахать,807654390
103,243921,2020-03-14,Це був сарказм,381526805
104,243675,2020-03-14,"Їм всеодно. Вони ж проводять ""обговорення"" /тухлый сарказм",1118279831
105,243344,2020-03-14,Яневського гетьманом і заєбок,1129881366
105,243345,2020-03-14,Ваш сарказм недоречен,507262628
105,243346,2020-03-14,це не сарказм,1129881366
106,243343,2020-03-14,Давайте самі об'єднуватись,507262628
106,243344,2020-03-14,Яневського гетьманом і заєбок,1129881366
106,243345,2020-03-14,Ваш сарказм недоречен,507262628
107,242710,2020-03-13,Бо нарід у нас поганий і тупий,367903709
107,242711,2020-03-13,це не так,93260642
107,242714,2020-03-13,"Я сарказмую, вибачте)",367903709
108,241680,2020-03-13,Сарказм?,367903709
109,241640,2020-03-13,"Ой, ну помилилася людина. Порошенко теж в партії регіонів був, а зараз націоналіст",610064129
109,241641,2020-03-13,"Життя плинне, а Гетьман - вічний",367903709
109,241643,2020-03-13,Сарказм в його бік невичерпний,610064129
110,239725,2020-03-12,Вечер надо стараться заканчивать на позитивной ноте. Поэтому вот вам немного иронии и сарказма от Богдана Процишина.,503775272
111,221812,2020-02-29,"""Найкращі іксперди з медицини"" голова РНБО Олексій Данілов і ""юний орел"" украраїнського шоу-бізу Михайло Поплавський, вважають, що сало - це таким символ України, що може врятувати від коронавірусу (сарказм)",624067515
112,218533,2020-02-27,"Романе, що за продавання гаража? Не годиться!",488912728
112,218541,2020-02-27,Це мені було сказано? Точно?,93260642
112,218547,2020-02-27,Сарказмую,488912728
113,214752,2020-02-25,@skrypin Як Вам мій новий клуб про пригоди молодшого сина Петра Порошенка?? Цікавить мене реакція,624067515
113,214753,2020-02-25,"Ти ж говорив , що це жовта преса",341883720
113,214754,2020-02-25,"Нє, просто виникла думка зробити свою версію тих подій зі сарказмом",624067515
114,214137,2020-02-25,29,269459986
114,214140,2020-02-25,Якось до четвертого десятку люди втрачають сенс іронії і сарказму,367903709
114,214150,2020-02-25,це не іронія ін е сарказм згадувати тут якихось вонючих москалів і присвоювати їм захлуги якісь в створенні україни,269459986
115,214137,2020-02-25,29,269459986
115,214140,2020-02-25,Якось до четвертого десятку люди втрачають сенс іронії і сарказму,367903709
116,213962,2020-02-25,для когось сарказм чужа мова,549581588
117,207366,2020-02-21,"Лукаш офігенна
Всі жіночі риси, які мене бісять, вона поєднує у химерному синтезі",367903709
117,207375,2020-02-21,У тебе гарячка?,893528335
117,207377,2020-02-21,Сезонне загострення сарказму,367903709
118,202773,2020-02-19,то сарказм чи льоня дибіл,549581588
119,195822,2020-02-14,"Або це якийсь занадто сильний сарказм, який не під силу моєму розумінню",488912728
120,192385,2020-02-11,Mykola ти ще плануєш діяльність у тилу ворога?),321716873
120,192386,2020-02-11,"А може в ОП, чув там нові вакансії відкриваються...",1034244006
120,192387,2020-02-11,"Ні, там мова йде про чат однієї пропагандистки з інтернет-видання Мертвечука) я вчора потролив їх і мене забанили, але Микола справжній боєць) і це без сарказму",321716873
121,190777,2020-02-08,"Попри все. Я не можу зрозуміти. Зеленському не треба було їхати у Ватикан й зустрічатися з Папою Римським? В чому суть претензій, сарказм та скепсіс?",93260642
122,178157,2020-01-30,"Я доречі, без сарказму питаю)",367903709
123,173354,2020-01-25,"Кулеба пояснив, навіщо Зеленський привітав Путіна з Новим роком

За словами Кулеби, привітання Зеленського були дипломатичним маневром.

🔎http://bit.ly/2uvLjh5",269459986
123,173396,2020-01-25,"Жаль що в 41 черчіль адольфовіча не привітав з НВ - війна швидше закінчилась б.....
сарказм",236297450
124,172824,2020-01-24,"наш найкращий, найпроґресивніший, найкмітливіший гетьман!",807654390
124,172828,2020-01-24,та хоч в його день народження обійдімося без сарказму,610064129
125,167509,2020-01-18,Пашинін не притомний. Він йобнутий. Але я про нього нічого не говорив. Або просто не пригадую.,93260642
125,167510,2020-01-18,"Цікаво, Ром поясни чому така реакція, я без сарказма та підтекста, я правда хочу зрозуміти, чого я не знав і пропустив по цій людині",832616383
126,165107,2020-01-15,"Все добре, але подібні джерела, мається на увазі канал, не дуже вітаються",321716873
126,165143,2020-01-15,"Тільки вони про це сказали.
Інші зраду розганяють 
Дубінського? Та ну нє",610064129
126,165146,2020-01-15,А може то ти просто певний набір каналів лише дивишся/читаєш?) бо в мене є протилежні приклади зі здоровим сарказмом щодо цієї події та без зради),321716873
127,165029,2020-01-15,"Не чіпайте куницького, він боровся проти хабарництва в патрульці, ідейний малий 😂",395231252
127,165034,2020-01-15,"Ти хочеш сказати, що він потрапив у погану компанію?",321716873
127,165036,2020-01-15,"ні, це був неприхований сарказм)",395231252
128,164372,2020-01-15,А какая разніца... (С) 😁😁,624067515
128,164373,2020-01-15,тупо,93260642
128,164376,2020-01-15,"Це ж сарказм, хоч і дещо не розумний.",624067515
129,163191,2020-01-13,"Зеля показав себе як надійний., рішучий лідер, який не боїться примати відповідальних рішень ( сарказм)",269459986
130,156555,2020-01-08,"Ти англійською написав, чи трошки тупенький?",93078251
130,156556,2020-01-08,С-сарказм для недорозуміючого один раз поясню😂,653273302
131,148364,2019-12-27,"ООО, ща будуть казочки про злого генія СОРОСА, який скуповує нашу землю. 😂😂😂",624067515
131,148366,2019-12-27,Што,44403824
131,148367,2019-12-27,С  - сарказм,624067515
132,144138,2019-12-19,Культурна індустрія в Україні?,610064129
132,144143,2019-12-19,а яким боком квартал до культури?,269459986
132,144145,2019-12-19,"Та ж сарказм, дядьку😂",610064129
133,143413,2019-12-19,,503775272
133,143416,2019-12-19,"Та блін, не ламайте мій сарказм(((",624067515
134,141961,2019-12-18,Чули. Тільки це не виключає твого свідомого або підсвідомого усіх людей на порохоботів чи зеленоботів,488912728
134,141966,2019-12-18,Не чули таки))),712133002
134,141973,2019-12-18,"В тебе левова частка з подібними загонами. Сказати ""ха, сарказм"" не виправдання",488912728
135,141944,2019-12-18,"Ні, тут всі латентні зелеботи, як і ти",712133002
135,141949,2019-12-18,Я пропоную тобі ввімкнути притомність,488912728
135,141954,2019-12-18,Ви про сарказм не чули?,712133002
136,141363,2019-12-18,"його там чмирили за слово ""зняток"", якраїнський аналог ""скріншот""",381526805
136,141367,2019-12-18,Однозначна загроза ідентичності,367903709
136,141369,2019-12-18,до чого тут цей сарказм?,381526805
137,139755,2019-12-17,Петро обіцяв влаштувати пізджц,342442182
137,139871,2019-12-17,"та я тут таке просто побачив , а  в мене можливо з сарказмом не все ок.",360270503
138,139390,2019-12-16,"На Прямому, бувало, телесеріал Зашкварені крутили, нікого не хвилювало",367903709
138,139393,2019-12-16,мене хвилювало,807654390
138,139396,2019-12-16,"Вау, круто! (Не сарказм)
Я таких людей у фб майже не зустрічав",367903709
139,135602,2019-12-13,може його дружина була мокшанкою?,11728558
139,135603,2019-12-13,"ні, ерзянка",381526805
139,135606,2019-12-13,(сарказм),381526805
140,131962,2019-12-10,"Я розумію цей сарказм,але камон",367903709
141,131842,2019-12-10,Підараси,269459986
141,131843,2019-12-10,То був сарказм,624067515
142,126182,2019-12-07,"Краще тоді уже поляків переселити на Схід і Південь, а ми до Польщі. 🌝

(Сарказм)",893528335
143,126149,2019-12-07,"Значить українські школи і мовні закони із квотами до дупи, і так нічого не зміниться, правильно?",381526805
143,126167,2019-12-07,Викладачі змінились?,893528335
143,126172,2019-12-07,"Чи почнемо з Заходу надсилати викладачів?) (сарказм) 

Як колись совєтська влада надсилала москвомовних викладачів на Західну Україну.",893528335
144,126080,2019-12-07,"Ось так коментують мітинги в Білорусі ЛІБЕРАЛЬНІ телеграм канали. Я не зрозумів, може це сарказм",238025269
145,126041,2019-12-07,Це би зменшило ймовірність 3 світової в рази,381526805
145,126042,2019-12-07,Сарказм? 🌝,893528335
146,123215,2019-12-05,сарказм,549581588
147,123210,2019-12-05,сарказм,269189888
148,122689,2019-12-04,"чому ж тоді ""пріятний в общєнії""",549581588
148,122690,2019-12-04,"може, сарказм",807654390
149,121663,2019-12-03,"А як щодо Парасюка? Людина злам історії, і питання до нього є",458290250
149,121670,2019-12-03,ЛЮДИНА ЗЛАМ ІСТОРІЇ? REALLY?,93260642
149,121672,2019-12-03,Це сарказм,458290250
150,115132,2019-11-28,зараз влад не якістю безвізу вирішила брать а кількістю,269459986
150,115134,2019-11-28,"Ну, тут Петра Олексійовича не переплюнути (не сарказм)",367903709
151,112834,2019-11-27,"У комментах під постом, що нижче, кілька людей не вкурили сарказм",367903709
152,110620,2019-11-25,"Зважаючи на те, що під час війни розвідка своїх не здасть, це от я розумію лише як спробу затягнути сепаратиста в серце України у велику політику. Або ж це привіт від наших оновлених спецслужб російським. І в одному і в іншому випадку зрада.",321716873
152,110622,2019-11-25,Соколова в цю хуйню повірила?,269459986
152,110628,2019-11-25,"Неясно, чи то сарказм, чи віра",321716873
153,105316,2019-11-19,"наша інформаційна політика - переважна більшість українців, які їдуть закордон з надією на легкий заробіток.",488912728
153,105324,2019-11-19,"Але ти правий)
У Польщі ставлення до українців сииильно покращилось",367903709
153,105331,2019-11-19,сарказм?,807654390
154,96545,2019-11-11,Ти точно не троль?),321716873
154,96546,2019-11-11,Наче тролить.,893528335
154,96548,2019-11-11,"Так, мені теж на сарказм схоже",321716873
155,92353,2019-11-07,"Порошенко однозначно алкоголік, немає в нього діабету! А Зє просто так завжди веселий, і часто нагадує добкіна молодшого. Все не буду більше богохульствувати.",930002948
155,92367,2019-11-07,"порошенко алкоголік?? нє, ну це бан",807654390
155,92392,2019-11-07,"Взагалі то був сарказм.
просто затяті зєфіли мене звинувачують в порохоботстві.
Наскільки відомо, порох діабетик, і звинувачувати його в алкоголізмі низько. Але для зєбілів поняття дна невідоме.",930002948
156,89875,2019-11-06,"Як так подивитись, і Сталін робив багато чого корисного",367903709
156,89883,2019-11-06,"Смертельну колективізацію?Розстріли?Переселення народів,що далі спричинило конфлікти?",503775272
156,89884,2019-11-06,"Агов
Сарказм же",367903709
157,89707,2019-11-06,"​​Сторінку Портнова у фейсбуці видалили, Лукаш горить. Таємний генерал СБУ Стерненко знову утискає правозахисників!111!!(Сарказм)",458290250
158,86696,2019-11-04,"Так, еміґруємо всі до Польщі, перейменуємо її на Малопольщу й нитимемо про „utysk ukrajinciw“ у нє зґіненай.",893528335
158,86699,2019-11-04,"боюся, такий план радше перетвориться на ""утиск рускоязичних""",807654390
158,86700,2019-11-04,То був сарказм. 🌚,893528335
159,85912,2019-11-04,чи то ти з сарказмом?),321716873
160,79972,2019-10-31,"​​Новий блог Катерини Супрун про Дубневича, незаконне збагачення та покарання для Яременка

Довгий день в Раді, але ми майже все зібрали до купи. Факти, коментарі та трохи сарказму😎

ДИВИТИСЬ 👉 https://youtu.be/HX5s5_ipYf4",103970031
161,73810,2019-10-29,"а з відки він знає? він тоді сценаріями совго помийного шоу був зайнятий. по рассії передавали, шо бандерівці начали от напевне так і є",269459986
161,73814,2019-10-29,"Ну як бандерівці. Вони віджали крим, тому це було очевидно, що підуть далі.",342442182
161,73821,2019-10-29,"ну то я сарказмую, як виглядав початок війни для зелі. все ж ще із майдану для нього почалось. а 4 місяціяв як і не було",269459986
162,70472,2019-10-26,"я недавно бачив на власні очі пост сірожі, де він писав, що альтернативи авякову НЕМА. тіпа нема в 40 млн країні мента, чеснішого за чорта авякова",549581588
162,70489,2019-10-26,"Ч думаю,  це був сарказм",361660809
162,70492,2019-10-26,"то не був сарказм. не знаю цей допис, про який ідеться, але він кілька разів у своїх постах в такому ключі про авакова писав",807654390
163,70451,2019-10-26,"Ну, я би так не сказав про Іванова. Бачив у нього кілька негативних постів і проавакяна, і про Пороха, і про Зе.",624067515
163,70472,2019-10-26,"я недавно бачив на власні очі пост сірожі, де він писав, що альтернативи авякову НЕМА. тіпа нема в 40 млн країні мента, чеснішого за чорта авякова",549581588
163,70489,2019-10-26,"Ч думаю,  це був сарказм",361660809
164,70323,2019-10-26,Ого прям бігус інфо,361660809
164,70326,2019-10-26,та це не бігус.інфо а відкрита інфа,807654390
164,70331,2019-10-26,Це був сарказм,361660809
165,69803,2019-10-26,бо це було круто. Так нагнути змазаного порохоботами та адмінресурсом чинного президента. Можна вивчати,691375476
