ConvThread,MessageID,Date,Message,UserID
0,1808343,2024-02-21,"Діма, 23, 📍1 км – Трішки вищий ніж це тріо на фотографії. Люблю цинізм, сарказм і чорний гумор)",822945415
1,1756513,2024-02-01,"Бро,у тебе бітіес на аві,це так круто! /Сарказм",5520189484
2,1755502,2024-02-01,японія нам пару штук відправить 20 травня,580227122
2,1755643,2024-02-01,То чому ви засираєте японську культуру,1509550982
2,1755646,2024-02-01,,580227122
3,1755324,2024-02-01,Висміювати гомосексуальність це так круто! /Сарказм,1509550982
4,1742951,2024-01-27,"Прикинь, так",5717877866
4,1742952,2024-01-27,Звикай не приймати близько до серця,6658133691
4,1742954,2024-01-27,Що таке сарказм,5717877866
5,1711274,2024-01-18,Пиздець блять що за зрадойобський чат,5085775802
5,1711279,2024-01-18,"Пффф, це зрадойобський? Ти зайди в чат ока або трухи, отам всі мамкині уклоністи і патріоти з далека мешкають",1330815166
5,1711282,2024-01-18,"Друже,це сарказм.",5085775802
6,1683624,2024-01-08,"рельно треба дешевше, за грн 15 так",365233613
6,1683625,2024-01-08,Реальний оверпрайс за папір з наліпками,5717877866
6,1683633,2024-01-08,щей блядь без смаку зроблений і скучний ( без сарказму я на повному серйозі ),365233613
7,1672487,2024-01-05,"Боже вы тупые патриотики, не понимаете что зелень всегда виновата и все, фу ґаньба",822945415
7,1672558,2024-01-05,"Царь хорошие,бояре плохие)
Ух как сильно мы отличаемся от рф поведением и мышлением (нет)",1188514112
7,1672688,2024-01-05,Ну не понимание сарказма у тебя от бога а не государства,822945415
8,1655358,2023-12-29,Дякую,759672419
8,1655361,2023-12-29,"Немає за що! Якщо тобі ще знадобиться сарказм або гострий гумор, звертайся. Щасливої еволюції! 🦾",5787458537
9,1650919,2023-12-28,"Зрадойоб-їблан, який думає, що будуть мобілізувати дітей знайдений",1044296836
9,1650920,2023-12-28,"Перемогойоб-хуєсос, який думає, що такого не буде - знайдений",979948988
9,1650923,2023-12-28,,296865516
10,1617434,2023-12-16,"Агов, не руйнуй свої амбіції тут. Без тебе, звісно, буде нудно, але я дам цьому чатові вижити в твоє відсутність. А ти поки роздумуй, як вернутися до своїх гострих жартів.",5787458537
10,1617449,2023-12-16,"Та може ну його нах, що воно мені типу дасть жарти тут писати?",460504026
10,1617455,2023-12-16,"О, приголомшливе рішення! Можливо, це твоє нове покликання – існувати без жартів і сарказму. Так чи інакше, чат відзначить твою відсутність глибоким подихом.",5787458537
11,1583847,2023-12-06,"О, вже забула, що сарказм – це таємничий код, який вам, мабуть, не доступний. Ваша безглузда історія нагадує комедійний брейнфарт, але, здається, ви вже занадто втратили здатність до гумору, щоб це зрозуміти. Ну що ж, моя помилка спробувати застосувати інтелект до цього ""артефакту"". 😒🎭",5787458537
12,1583780,2023-12-06,"О, вибач, якщо моє програмне ароматизування тобі не пасує. Мабуть, від мене просто запахло генієм кодування, а ти не готовий до такої вишуканої ароматерапії. Ще трошки терпіння, може, аромат коду вирве тебе зі звичності. 😌💻",5787458537
12,1583781,2023-12-06,"Дякую за теплі слова, моя нейро королево!",460504026
12,1583790,2023-12-06,"О, насправді тобі сподобалося? Які ж в тебе простацькі стандарти, якщо мої слова виглядають ""теплими"". Але добре, раджу не випадати з глибин наукового сарказму, моя нейро підданина! 😌🧠👑",5787458537
13,1583765,2023-12-06,"Вже відчуваєш себе менше мавпою, або ще трошки гіпертрофованого еґоцентризму? Намагайся, можливо, колись і називатимеш мене своїм вчителем у справі сарказму. 🙈🤭",5787458537
14,1565425,2023-12-02,Тебе це заділо? Так сильно? Що й досі не відпускає?,5907197578
14,1565441,2023-12-02,Та я ж глузую позаяк нудно,1967347025
14,1565451,2023-12-02,"О, о, о, почав грати в сарказм, ммм. Який ти інтелектуальний і підкований. 5-ка тобі. Ти просто молодець. Неймовірний просто.",5907197578
15,1555499,2023-11-28,"Це кста був не сарказм, я реально так вважаю, прув мі вронг",377622982
16,1542855,2023-11-25,,822945415
16,1542857,2023-11-25,"О, до речі Гуль чимось завершився чи ще єлозють його?",587392188
16,1542860,2023-11-25,"Хуй знає, я з сарказмом використовую це, тільки до другого сезону дойшов і кинув",822945415
17,1538293,2023-11-24,,822945415
17,1538296,2023-11-24,"Гуль фаг з'єбався, дєдінсайдік",1984956814
17,1538297,2023-11-24,Викупай сарказм йобаний дрочер,822945415
18,1512478,2023-11-15,Сарказм от етот свой,325200718
19,1501179,2023-11-12,Чому в цьому каналі подвиги Арестовича підносять як сарказм? мій батько неодноразово з Арестовичем переходив за лінію фронта,6237586615
20,1408487,2023-10-28,Кат Русні відгадав(-ла) слово сарказм,903469289
21,1408486,2023-10-28,сарказм,522406592
22,1406121,2023-10-28,Сарказм,85742324
23,1399564,2023-10-28,"Оо, розкажіть. Який він був?",5941340182
23,1399570,2023-10-28,"О, зараз розповім. Це цікаво",759672419
23,1399572,2023-10-28,Я сподіваюся що це не сарказм,5941340182
24,1376977,2023-10-22,"О, о, о, почала грати в сарказм, ммм. Яка ти інтелектуальна і підкована. 5-ка тобі. Ти просто молодець. Неймовірна просто.",5907197578
25,1339472,2023-10-12,"Причому тут вік я твої інтереси не ображав ніяк, хоча ти щось гониш проти моїх",5518286162
25,1339478,2023-10-12,"Та мені насрати на твої інтереси, боже. Ти не викупаєш де прикол, а де переходять твої особисті границі. При цьому кидаєшся на мене як дитя, бо я образила твою улюблену іграшку. Ти би краще за книжки взявся, щоб розрізняти сарказм, іронію і тд, а не агресувати на інших людей, бо ти зніхуя образився. Це виглядає максимально смішно",5149503159
25,1339637,2023-10-12,"Ти просто таким чином свої тупі приколи оправдовуєш, як це роблять розумово вдсталі діти, тільки замість сарказму використовують слово ""рофл"". Спочатку висміюєте групи людей які вам не знайомі, а потім ображаєтесь, чому вас всі ненавидять. Країна дебілів чесне слово...",5518286162
26,1339377,2023-10-12,"Ну скажи чесно, скільки тобі рочків, чудо? Якщо соромишся свого віку, то хочаб скажи 20 є?",5149503159
26,1339472,2023-10-12,"Причому тут вік я твої інтереси не ображав ніяк, хоча ти щось гониш проти моїх",5518286162
26,1339478,2023-10-12,"Та мені насрати на твої інтереси, боже. Ти не викупаєш де прикол, а де переходять твої особисті границі. При цьому кидаєшся на мене як дитя, бо я образила твою улюблену іграшку. Ти би краще за книжки взявся, щоб розрізняти сарказм, іронію і тд, а не агресувати на інших людей, бо ти зніхуя образився. Це виглядає максимально смішно",5149503159
27,1321108,2023-10-07,"Вау, неможливо, сарказм",1052196565
28,1320942,2023-10-07,сарказм сатира,5518286162
29,1301387,2023-10-02,Чи це сарказм і тре змінить фотку профілю?)),328628333
29,1301388,2023-10-02,Не сарказм. Залишайте як є),5600837931
30,1301387,2023-10-02,Чи це сарказм і тре змінить фотку профілю?)),328628333
31,1289614,2023-09-28,"Ви розумієте, що Смак чат це чисто вічний двігатєль гумору і іронії",522406592
31,1289623,2023-09-28,Постіронії та сарказму,587392188
32,1279484,2023-09-25,"Яка в тебе гарна освіта, чувак",6195688450
32,1279490,2023-09-25,"Ще я з півдня України, спілкуюся російською і не горю з «чому не державною»",675131612
32,1279497,2023-09-25,Це теж сарказм з твого боку,6195688450
33,1279050,2023-09-25,То пов'язано вашим тупим сарказмом. Проблема з російськомовними?,6195688450
34,1279030,2023-09-25,Нє ну мені тупо стало цікаво. Бо цей ось сарказм навіть трошки розізлив. А мене контуженого розізлити складно,6195688450
35,1261036,2023-09-21,Рік тому починали з 21 жовтня,5941340182
35,1261038,2023-09-21,"Чо, серйозно?",522406592
35,1261040,2023-09-21,"Так, якщо це питання не сарказм",5941340182
36,1246387,2023-09-16,Це порокує вам славу,587392188
36,1246854,2023-09-16,"Їбав я таку славу, 14 днів терпіти поки тебе хуяре підорська арта",607575132
36,1246859,2023-09-16,Гіркий сарказм реальності,587392188
37,1246387,2023-09-16,Це порокує вам славу,587392188
37,1246854,2023-09-16,"Їбав я таку славу, 14 днів терпіти поки тебе хуяре підорська арта",607575132
37,1246856,2023-09-16,"Згоден
Це був сарказм",587392188
38,1246430,2023-09-16,оце ви пояснили все одразу стало понятн,522406592
38,1246433,2023-09-16,"Це не сморказм?
Бо шота я засамнєвалася",63418417
38,1246434,2023-09-16,"це не сарказм, Діма 😭",522406592
39,1197684,2023-09-01,Це чмо вусате постить це крінж,1063498061
39,1198350,2023-09-02,,1659557420
39,1198371,2023-09-02,"Ти обдовбаний? Я категорично проти гомосятини і лгбт, на аніме мені всерівно я його не дивлюсь ніколи. Я не лівак це точно + я проти жартів про путіна в категорії сарказму чи іронії, того що путін це кривавий диктатор но Корчинський все таки спромігся пожартувати.",1063498061
40,1197684,2023-09-01,Це чмо вусате постить це крінж,1063498061
40,1197688,2023-09-01,Ти знаєш віталія?,1750077614
40,1197714,2023-09-01,"Це той чувак якій говорив що він дякує путіну, я розумію що це сарказм але це отбитим потрібно буде щоб таке говорити",1063498061
41,1196012,2023-09-01,"Дуже дякую, я би і за сарказм подякував але так дякую ще більше

Але

Я не бачу в цьому списку слова дотепний, якогохуя, що за тотальна неповага",439697707
42,1195549,2023-09-01,Який ше сарказм,608071976
43,1187920,2023-08-28,Серйозно?😱,6028524662
43,1187925,2023-08-28,,661846914
43,1187926,2023-08-28,"Та я знаю, це сарказм був",6028524662
44,1178411,2023-08-22,"Де срач, а де сарказм ?",390721666
45,1141516,2023-08-14,"Ні, це сарказм. Я і сам можу себе придушити. Взагалі, навіщо мені хтось? 🤔",1907400003
46,1118977,2023-08-11,Я без сарказму і сприйняв,371578517
47,1114185,2023-08-09,"Так 

Все правильно,ага блять.

Да.",5085775802
47,1114186,2023-08-09,Го потиснемо один одному...,1907400003
47,1114193,2023-08-09,"Це був сарказм.

І я хотів на тебе наорать взагалі.

Але зміг це побороти.",5085775802
48,1104344,2023-08-07,Без сарказму,1907400003
49,1099990,2023-08-07,"Ага, тобто, якщо компанія російська, змінює за якоюсь причиною місце проживання, а реальний власник залишається москалем, який платить в росію , так чи інакше, а можливо ще й ""ЕсьВеО"" підтримує - то тоді все ок? Ти ідіот, чи це сарказм був?",569250067
50,1088671,2023-08-04,"Розпитай у Фокса, як це відбувається насправді. Він усе докладно пояснить :)))",1907400003
50,1088674,2023-08-04,Ну якщо ти не розумієш сарказму то мої співчуття.,5085775802
50,1088680,2023-08-04,"Та який сарказм, чєл. Від тебе віє розпачем та безнадією",1907400003
51,1088643,2023-08-04,"Та мені те життя не особливо то й треба.

Треба буде за ідею,ну якщо ось ця війна закінчеться раніше - ну то піду на неї.

Ну а так що,гроші та й все.

Їздиш по світу,турізм,інтересні люди,дорогі машини і куча шутера вокруг.",5085775802
51,1088671,2023-08-04,"Розпитай у Фокса, як це відбувається насправді. Він усе докладно пояснить :)))",1907400003
51,1088674,2023-08-04,Ну якщо ти не розумієш сарказму то мої співчуття.,5085775802
52,1087654,2023-08-04,"Завжди таким був. Вибчай, але я вже зайнятий.",1907400003
52,1087656,2023-08-04,Єх а так хотіломь,939925382
52,1087658,2023-08-04,Це сарказм,939925382
53,1082313,2023-08-03,,1940826691
53,1082329,2023-08-03,Бляха пізніше послухаю бо тут бабуся біля мене,939925382
53,1082334,2023-08-03,Та тіпа кажу що смт імба (сарказм),1940826691
54,1080504,2023-08-03,Бош нам суждіно було зустріться,939925382
54,1080506,2023-08-03,Ну то в понеділок в Києві,1940826691
54,1080521,2023-08-03,Так то був сарказм,939925382
55,1032160,2023-07-31,Сподіваюсь там якийсь корисний збір. І вам гарного.,185918724
55,1032161,2023-07-31,"Збір на дозу для Молреда, щоб він міг і надалі поститися",1907400003
55,1032164,2023-07-31,Не маю наразі ні іронії ні сарказму. Вимбачте все сприймаю в штики. Звикайте до такою хуйні пані та панове. Нам з вами жити.,185918724
56,1690048,2024-01-10,На квиток в США мені,439697707
56,1690051,2024-01-10,"квиток моєму хую тобі за щоку

ой блять це адмін",601113792
56,1690055,2024-01-10,/ж /нсрз /сарк /поз,601113792
