ConvThread,MessageID,Date,Message,UserID
109,5370,2023-04-20,"то був сарказм. А якщо серйозно, то чому ви думаєте що цей політ ніколи не окупиться? бо колись казали що й саджати перший ступінь погана ідея, яка ніколи не окупиться. А зараз можна порівняти скільки кг вивели на орбіту SpaceX в цьому році і скільки всі решта разом узяті. І результат буде не на користь всіх решта))",874101884
110,4877,2023-04-20,"Так, все ж таки, що то було 🤔
""...летіло - не впало, а так загуло...""🤬",5024665897
110,4880,2023-04-20,"Та вже всі знають, що метеорит. Хіба воно ще й гуло? Не тільки світило?)",917421744
110,4883,2023-04-20,Це був сарказм про вашу дискусію🙄,5024665897
111,4805,2023-04-20,"це сарказм, чи ви реально думаєте, що вони мусять нас кликати ледь не на колінах , а не ми прагнути приєднатися? Тим паче, воюючу країну вони не приймуть, а от по перемозі вже у нас в руках м'яч і наш час-тайм аби заскочити у альянс",861647912
112,3918,2023-04-19,"У тому і вся суть) Наявність піхви дає право на свідомий вибір - вступати в лави ЗСУ, чи пити коктель десь на березі Середземного. І як не дивно(сарказм), громадян з піхвою, такий порядок речей влаштовує.",250622820
113,3580,2023-04-19,"цікаво,а за шо люди його захейтили..? типу,якщо ти батюшка ,то танцювати не можна чи шо",416447847
113,3600,2023-04-19,"Та ж піст... Не гоже тако парафіянам дурниці показувати. То ж то цирк натуральний, яка в тому мораль ? Якщо священик такий-о несерйозний то шо про паству можна сказати ? Всі поголовно у гріхови",1024015272
113,3738,2023-04-19,"Це сарказм, чи у вас деякі проблеми з розумінням тексту?)",539192691
114,3203,2023-04-18,"Для таких людей терапевт хороша міра покарання) (це не сарказм, зазвичай вони їх бояться)",497971308
115,1347,2023-04-15,Бог тєрпєл і нам вєлєл,456967002
115,1368,2023-04-15,Ти мабуть не бачила як страждають невиліковні на останній стадії коли вже і морфін не допомогає..,5039816356
115,1370,2023-04-15,То ж сарказм був,351818094
116,148125,2023-12-15,"<fat_sarcasm>
Та забороняйте вже геть усе: фейсбук, телеграм, тікток, інстаграм, онліфанс, вімео, ютуб...

Нащо навчати медіа-грамотності? Краще все заблокувати =) І дати волю новим амбітним стартапам від хот-хайп розробників!

(згадує часи weua)
</fat_sarcasm>",137312462
117,113442,2023-09-29,,391588657
118,103581,2023-09-11,Аж два (sarcasm),5212544919
